"","pagination.page_number","pagination.page_size","pagination.page_count","events.id","events.url","events.organization_id","events.created","events.changed","events.published","events.status","events.currency","events.listed","events.shareable","events.online_event","events.tx_time_limit","events.locale","events.is_series","events.is_series_parent","events.inventory_type","events.is_reserved_seating","events.show_pick_a_seat","events.show_colors_in_seatmap_thumbnail","events.source","events.is_free","events.summary","events.organizer_id","events.venue_id","events.category_id","events.subcategory_id","events.format_id","events.is_externally_ticketed","events.name.text","events.description.text","events.end.timezone","events.end.utc","events.end.utc.1","events.logo.original.width","events.logo.original.height","location.latitude","location.longitude","location.augmented_location.country","location.address","label"
"43",1,50,25,"66528750283","https://www.eventbrite.com/e/summer-wine-dinner-with-tre-monti-tickets-66528750283?aff=ebapi","11022737805","2019-07-24T23:49:49Z","2019-07-28T20:35:32Z","2019-07-24T23:54:36Z","live","USD",TRUE,TRUE,FALSE,480,"en_US",FALSE,FALSE,"limited",FALSE,FALSE,FALSE,"create_2.0",FALSE,"Azienda Agricola Tre Monti is one of our favorite wine producers from the region of Emilia Romagna, and we are delighted to showcase their d","890102405","34903407","110",NA,"8",FALSE,"summer wine dinner with tre monti","Azienda Agricola Tre Monti is one of our favorite wine producers from the region of Emilia Romagna, and we are delighted to showcase their delicious wines for our upcoming Summer Wine Dinner. All of Tre Monti's vineyards are managed according to the principles of organic sustainable viticulture, they use only estate-grown local varietals, and the wine is made with a philosophy of minimal intervention. Every step in this process is carried out with full respect, not only for the integrity of the fruit, but for the unique character of each growing year as well. The result are unique wines that express fully the terroir of the region. They are light and complex, the perfect wines for a summer feast.
We hope you can join us!
The Menu__________
Caponata di MelanzaneSicilian eggplant “caponata”, Tomatoes, olives, pinenuts, onions, celery, raisins, basil
Wine pairing: Albana di Romagna 2018__________
Tomino alla PiastraGrilled Tomino cheese, wild mushrooms, fresh oregano
Wine pairing: Albana di Romagna ""Vitalba Anfora"" 2018__________
Gnocchi alla RomagnolaPotato gnocchi, beef ragù, bay leaves, grana padano cheese
Wine pairing: Sangiovese ""Campo di Mezzo"" 2018__________
AristaRoasted Berkshire pork loin, peaches, zucchini, fresh mint
Wine pairing: Sangiovese Riserva ""Thea"" 2016__________
CrostataFresh blueberry crostata, whipped cream
Wine pairing: Moscato 2018

*Vegetarian options available upon request. We can accomodate most dietary restrictions.","America/New_York","2019-08-21T02:00:00Z","2019-08-21T02:00:00Z",748,300,"40.712775","-74.005973","United States","new york city","wine"
"44",1,50,25,"63127996537","https://www.eventbrite.com/e/wine-cheese-pairing-murrays-cheese-tickets-63127996537?aff=ebapi","141392852881","2019-06-07T19:54:51Z","2019-07-22T02:09:12Z","2019-06-07T19:55:27Z","live","USD",TRUE,TRUE,FALSE,480,"en_US",FALSE,FALSE,"limited",FALSE,FALSE,FALSE,"create_2.0",FALSE,"While it's difficult to imagine not enjoying a sip of wine with a hunk of your favorite cheese, certain combinations will particularly titil","8172404165","33036810","110","10002","9",FALSE,"wine & cheese pairing @ murray's cheese","While it's difficult to imagine not enjoying a sip of wine with a hunk of your favorite cheese, certain combinations will particularly titillate your tongue and make your soul sing. Join us for a whirlwind tour of the wine and cheese world as we sample red, white, and dessert wines from around the world. Learn which cheese types best match your favorite wines and get insider tips on how to find the right match on your own. Join us for a pairing session to explicate the essential fundamentals of wine and cheese harmony.
*PER MURRAYS CHEESE POLICY, WE DO NOT ALLOW TRANSFERS OR REFUNDS FOR OUR CLASSES","America/New_York","2019-08-08T00:00:00Z","2019-08-08T00:00:00Z",2100,1552,"40.712775","-74.005973","United States","new york city","wine"
"46",1,50,25,"63492647217","https://www.eventbrite.com/e/wine-cheese-pairing-murrays-cheese-tickets-63492647217?aff=ebapi","141392852881","2019-06-14T19:07:33Z","2019-07-28T22:31:47Z","2019-06-14T19:08:36Z","live","USD",TRUE,TRUE,FALSE,480,"en_US",FALSE,FALSE,"limited",FALSE,FALSE,FALSE,"create_2.0",FALSE,"While it's difficult to imagine not enjoying a sip of wine with a hunk of your favorite cheese, certain combinations will particularly titil","8172404165","33255849","110","10002","9",FALSE,"wine & cheese pairing @ murray's cheese","While it's difficult to imagine not enjoying a sip of wine with a hunk of your favorite cheese, certain combinations will particularly titillate your tongue and make your soul sing. Join us for a whirlwind tour of the wine and cheese world as we sample red, white, and dessert wines from around the world. Learn which cheese types best match your favorite wines and get insider tips on how to find the right match on your own. Join us for a pairing session to explicate the essential fundamentals of wine and cheese harmony.
*PER MURRAYS CHEESE POLICY, WE DO NOT ALLOW TRANSFERS OR REFUNDS FOR OUR CLASSES","America/New_York","2019-08-14T00:00:00Z","2019-08-14T00:00:00Z",2100,1552,"40.712775","-74.005973","United States","new york city","wine"
"49",25,50,25,"64392552859","https://www.eventbrite.com/e/rafa-barrios-oscar-l-stereo-productions-boat-party-nyc-tickets-64392552859?aff=ebapi","190353750759","2019-06-27T21:22:12Z","2019-07-03T16:04:11Z","2019-07-02T01:33:03Z","live","USD",TRUE,TRUE,FALSE,480,"en_US",FALSE,FALSE,"limited",FALSE,FALSE,FALSE,"create_2.0",FALSE,"Stereo Producetions lands in NYC for a special night on the Hudson.  

Set sail to the beats of RAFA BARRIOS & OSCAR L

This one is for the ","12316350145","33649242","103","3006","6",FALSE,"rafa barrios & oscar l: stereo productions boat party nyc","Stereo Producetions lands in NYC for a special night on the Hudson.  

Set sail to the beats of RAFA BARRIOS & OSCAR L

This one is for the record books.
Catch a VIBE on the iBoatNYC - Summer Concert Cruise Series with Hornblower New York featured on: DancingAstronaut.com, EDM.com, ElectricVibes.com, TheNocturnalTimes.com, Realedm.com, Mix247EDM.com, Beatfeeds.com & TheGrooveCartel.com

Open Air Deck - Main Stage (Concert):
STEREO PRODUCTIONS
RAFA BARRIOS & OSCAR L
MITCHELL FREDERICK

Middle Deck - Latin Floor:
Latin Music, Reggaeton, Latin Trap, Salsa, Bachata, Merengue, Classic & Rock Cross-Over Reggae Hip Hop Music w/ Special Performances by  Local Up and coming Artists.

Bottom Deck - The Lounge:
House / Deep House / Techno / Trance - Chill-Hang Out Lounge

YACHT DESCRIPTION 
The Great Point
We Made the Great Point Great Again! Are you trying to live your best life? If the answer is YES, then buy a ticket to the Number 1 Boat in New York City. Take a picture with a Statue of Liberty, Brooklyn Bridge and Freedom Tower while you're dancing your shoes off to your favorite DJs! Three Concerts, all in one Boat Party (Three dance floors, three levels of music). 10+ DJs & Live performers



Every Floor has VIP table sections. If you purchase a VIP Table Section, you don’t have to stay at your table the whole night. The waitress can put your bottles away, place a rope in front of your table & make sure no one sits at your table. When you decide to return to your table, the waitress will bring out your bottles. Your table is guaranteed for the ENTIRE night.


Every Floor has a cocktail bar that also serves beer & wine. Specials on Buckets of Beers.


TWO VIP Gardens.


Food Available for Purchase - Yes we have specialty Food Vendors! - Dinner Reservations Available.


Yes Parking is Available at the Pier - Pier 40: $40.00 - Pier 15: $30.00 (one block away). FREE Street Parking Available around the Pier (it is relatively easy to find parking)


VIP Bottle Service / Sections - Available for Sale. Call/text Allan (646)-263-4593 and/or email: rsvp@crustnation.com for the Bottle Services Flyer / Packages.


Special Birthday/Bachelor/Bachelorette Packages available.


Contact us for dinner/party reservations (Balloons & Cakes permitted, no other outside food allowed). LED screens, VIP Gardens, and state-of-the-art lighting and sound systems - they make our boat cruise the perfect place to party on the harbor with some of the best artists in the world. VIP Tickets include Express Line and 1 FREE Drink of your choice! Also includes access to the VIP Garden.


Yes are 4/20 Friendly !!!!!!!!!!! Light it !


Free Merch Giveaways.



Event Information:

Pier 15: 78 South Street (South Street Seaport), New York, NY 11038

Boards: 9:00 PM
Departs: 10:30 PM
Returns: 2:00 AM

Rain or Shine
21 & over with proper ID


DRESS CODE POLICY: Trendy but Comfortable / STEREO PRODUCTIONS Friendly
- Please be aware that photography and videotaping takes place on the boat. The photos & videos will be posted to our Facebook & Instagram pages:
www.facebook.com/crustnation
www.instagram.com/crustnation

Have a Celebration coming up?
We make it possible for you to host your company/corporate, art, fashion, music showcases, birthday parties & private dinners at a number of unique event spaces & a fleet of 6 yachts.
Booking your event with Crust Nation will get you more bang for your buck! Let us show you how New York parties!
For more information & to reach out to us visit crustnation.com
Want to get personal? call/text/email @ahmadvanallan
(646) 263-4593
ahmadallan@crustnation.com

About Artists:
RAFA BARRIOS
Young DJ and producer Rafa Barrios is on fire all over the world. The Sevilla native has published several records on various labels including but not limited to Intec, Stereo, Sola, and Blackflag. Rafa is one of the most prolific producers on the market in 2019; his Tech House music bringing a new and refined sound to the House music community. His tracks have been played by Carl Cox, Richie Hawtin, Marco Carola, Jamie Jones, Danny Tenaglia, Dubfire, and Stacey Pullen -who are not only some of the most respected artists in the industry but inspirations in Barrios’ musical upbringing.
Rafa has recently remixed artists Kim English, Chus & Ceballos, Boris, Gabriel Ananda, and Danny Tenaglia. All of which led to his production of hits’ Flip Flop and Woohoo- both on Sola, that were in Beatport’s Top 10 in 2018.
The past few years he has been performing in Barcelona, Madrid, Amsterdam, Bali, Belgium, Montreal, Miami Florida, Brooklyn New York, Ecuador, and Peru- just to name a few. Currently, you can catch him performing under elite labels Elrow and Repopulate Mars. Rafa’s Spanish roots shine through the deep current that is his unique version of tech house, with a career projection that has no limit.

OSCAR L
With more than 10 years of international experience behind him, Oscar L is one of the essential names of the Iberian electronic scene. Personality, perseverance and energy define him and are qualities that are also found in his particular sound, a combination of influences and peculiarities that have caught the attention of the best labels on the globe, such as Suara, Toolroom, Truesoul, 1605, Stereo or Material, amongst others, all of them being connoisseurs of the talent and the effectiveness that the productions of the Spanish artist reunite.
A tasteful mixture that have been used to put a good handful of tracks at the top of the Techno and House charts. These capabilities have given Oscar the opportunity to travel the world making the most diverse audiences dance. Dozens of cities from different continents throughout the world have enjoyed the intensity and warmth that his sets transmit to the dance floor. But the diffusion of his music does not end there, for a few years now, Oscar has also been directing his own radio show, D-Mix, which is broadcasted in 16 countries through 90 different stations. Oscar L's professional framework continues to expand, foreshadowing a prolific future and a privileged position amongst the most outstanding figures of his country.



























","America/New_York","2019-08-18T06:00:00Z","2019-08-18T06:00:00Z",1131,1600,"40.712775","-74.005973","United States","new york city","wine"
"50",25,50,25,"66818484887","https://www.eventbrite.com/e/monetize-your-magic-live-new-york-city-tickets-66818484887?aff=ebapi","97345683","2019-07-28T20:46:15Z","2019-07-28T20:53:04Z","2019-07-28T20:51:59Z","live","USD",TRUE,TRUE,FALSE,300,"en_US",FALSE,FALSE,"limited",FALSE,FALSE,FALSE,"create_2.0",FALSE,"


Is it time for you to stop procrastinating and finally start making money doing what you love?
 
Do you want to create a business th","1266039673","34988995","101",NA,"9",FALSE,"monetize your magic live - new york city","


Is it time for you to stop procrastinating and finally start making money doing what you love?
 
Do you want to create a business that helps others, makes a big impact AND allows you to earn a great income?
 
Have you been dreaming of a location-independent lifestyle that allows you to travel and work from anywhere in the world?
 
Do you desire to replace your income so you can quit your job and live life on your own terms?
 
Are you ready to become your own boss so that you can have the freedom to do whatever you want, whenever you want?
 
Have you been longing to meet like-minded women who have big dreams for their lives and businesses?
 
If you answered 'yes' to any of those questions, then make plans to join mindset and 24, 2019 at the beautiful W Hotel in Downtown New York City! (If you’re wondering whether it will be worth driving up, taking the train or doing a carpool…the answer is YES!)
 
Get ready for a powerful 1/2 day business and mindset seminar that will show you how to turn your expertise into a profitable online business that transforms lives and gives you the freedom to travel the world and live life on your own terms! 
 
Think of this as a sacred space for education, inspiration and motivation in a high-vibration environment, giving you permission to dream bigger than you ever have before. One thing is for sure - you will leave this event feeling EMPOWERED to create the life and business of your dreams!
 
In this seminar, you will learn:

How I went from working a 9 to 5 nonprofit job to running a multiple 6-figure location-independent business that empowers women AND gives me the freedom to travel and live life on my own terms! (plus, how I got my first paying client!)
The #1 thing holding you back from being able to build a successful online business and location-independent lifestyle (hint: it's probably not what you think...)
10 different revenue streams you can create in your business based on your passion, skills, education, expertise and experience
5 questions that will help you get clarity on which business idea to focus on so that you can monetize quickly (this simple exercise will spark SO many ideas for you!)
My proven step-by-step process that will show you how to launch (or relaunch) your online business and get PAYING clients in 8 weeks or less 
PLUS: Live group coaching with Rosetta!

This event will also be a great opportunity to network and find your tribe of ""business besties"" who are ready to go BIG in their lives and businesses! 
 
Your general admission ticket includes access to the 1/2 day seminar, live group coaching with Rosetta and a light breakfast, PLUS a printed Monetize Your Magic Workbook & Action Plan where you will be able to map out your plans to launch and grow your own online business this year.
 
You can also choose to upgrade to VIP and enjoy a delicious catered lunch and an exclusive bonus Q&A session just for VIPs with Rosetta immediately following the seminar!
 



WHAT’S INCLUDED IN MONETIZE YOUR MAGIC LIVE:






1/2 Day of Training & Coaching with Rosetta Thurman
Printed Monetize Your Magic Workbook & Action Plan
Coffee & Light Breakfast
Discounted Hotel Room Rate (Register by August 2 for the Hotel Discount!) 
Delicious Catered VIP Lunch (VIP Attendees Only)
Bonus VIP Q&A Session with Rosetta (VIP Attendees Only)
Authentic Networking with Ambitious Black Women Just Like You!

PLEASE NOTE: Space is very limited at this event and available on a first-come, first-served basis. There will be NO tickets sold at the door. Register now to reserve your spot! 
 



GOT QUESTIONS BEFORE YOU REGISTER?

Email any questions you have to Team Happy Black Woman at support@happyblackwoman.com.
 

ABOUT ROSETTA THURMAN

Rosetta Thurman is the Founder and CEO of Happy Black Woman®, a personal development company, lifestyle brand and global community that empowers Black women entrepreneurs to create the life and business of their dreams.
 
In 2010, she quit her nonprofit job in Washington, DC to work for herself as a speaker, coach and consultant. The following year, she got rid of all her stuff, gave up her apartment and began traveling the world with just a suitcase and a laptop, working from her dream destinations of Hawaii, Thailand, Greece, France, Italy, Spain, Jamaica, Mexico, Argentina and Bali!
 
 
Fast forward to today and Rosetta has helped thousands of Black women through valuable content, actionable training, practical coaching, transformational events and a supportive community.
 
 
Rosetta is the host of the Happy Black Woman Podcast and creator of the Happy Black Woman Business Academy. She is the author of Launch Your Business: The 5 Step Solution to Do What You Love, Quit Your Job and Have the Freedom to Travel and Live Life on Your Own Terms.
 
 
Drawing on over 15 years of experience in leadership development, business consulting and organizational management, Rosetta has spoken at over 100 events around the country.
 
 
She has been featured in numerous media outlets, including Essence, Black Enterprise, SUCCESS Magazine, JET Magazine and Entrepreneur. Rosetta holds a Master’s Degree in Organizational Management and has also taught leadership, business and marketing as an Adjunct Professor at Trinity Washington University.
 
 
Rosetta currently lives in San Diego, California. When she’s not working, you can find her on a plane traveling to the next city on her bucket list, in the kitchen cooking a new recipe, dancing to 80s music or snuggled up in her favorite chair with a good book and a glass of red wine.
 
 
Her motto is: “You can do anything you want with your life and no one can stop you…but YOU!”
 
FREQUENTLY ASKED QUESTIONS


Q: What day and time is the event being held?A: Monetize Your Magic DC is being held on Saturday, August 24, 2019. Doors open at 8:00am for breakfast and networking. The program will begin promptly at 8:30am.Q: Where will the event be held?A: This event is being hosted at the W New York - Downtown in New York City.Q: Is there a discounted room rate at the host hotel?A: Yes! The W New York - Downtown has provided a discounted rate of $189 for the dates of August 23-25. Once you purchase your ticket, you will receive information on how to book your room if you desire to stay at the W!Q: Can I purchase a ticket at the door?A: No. Space is very limited at this event and available on a first-come, first-served basis. There will be NO tickets sold at the door.Q: What is the refund policy? A: No refunds will be given under any circumstances, however your ticket is TRANSFERABLE to another person if you are unable to attend.Q: Where can I contact the Happy Black Woman Team with any questions?A: You may contact us at support@happyblackwoman.com if you have any questions about the event! 
 

LEGAL DISCLAIMER
Every effort has been made to accurately represent this program and its potential. Any claims made of actual earnings are exceptional results and are not intended to represent or guarantee that anyone will achieve the same or similar results. Each individual’s success depends on their background, professional ability and level of follow-through. As with any business endeavor, there is an inherent risk and there is no guarantee that you will earn any money with the methods taught in this program. The templates and materials provided are for educational purposes only and should not be misconstrued as legal or financial advice. 







","America/New_York","2019-08-24T16:00:00Z","2019-08-24T16:00:00Z",NA,NA,"40.712775","-74.005973","United States","new york city","wine"
